 <?xml version="1.0"?>
<xs:schema xmlns:xs="http://www.w3.org/2001/XMLSchema"
targetNamespace="https://www.w3schools.com"
xmlns="https://www.w3schools.com"
elementFormDefault="qualified">
<xs:element name="bookstore">
  <xs:element name="book" type="book"/>
</xs:element>
<xs:element name="book">
  <xs:complexType>
    <xs:sequence>
      <xs:element name="title" type="xs:string"/>
      <xs:element name="author" type="xs:string"/>
      <xs:element name="ISBN_number" type="xs:string"/>
      <xs:element name="publisher" type="xs:string"/>
      <xs:element name="edition" type="xs:integer"/>
      <xs:element name="price" type="xs:decimal"/>
    </xs:sequence>
  </xs:complexType>
</xs:element>
</xs:schema> 